{
  "affected_artifacts": [
    "packages/real-github",
    "packages/real-bodies",
    "tests/real-github",
    "tests/real-bodies",
    "docs/evidence/production-connectivity/github-execution"
  ],
  "added": [
    "packages/real-github/package.json",
    "packages/real-github/tsconfig.json",
    "packages/real-github/tsconfig.build.json",
    "packages/real-github/vitest.config.ts",
    "packages/real-github/src/index.ts",
    "packages/real-github/src/github-vocabulary.ts",
    "packages/real-github/src/provider-state.ts",
    "packages/real-github/src/fetch-transport.ts",
    "packages/real-github/src/api-records.ts",
    "packages/real-github/src/environment.ts",
    "packages/real-github/src/real-provider.ts",
    "packages/real-github/test/structure.test.ts",
    "packages/real-bodies/package.json",
    "packages/real-bodies/tsconfig.json",
    "packages/real-bodies/tsconfig.build.json",
    "packages/real-bodies/vitest.config.ts",
    "packages/real-bodies/src/index.ts",
    "packages/real-bodies/src/model-port.ts",
    "packages/real-bodies/src/openrouter-client.ts",
    "packages/real-bodies/src/hosted-coding-body.ts",
    "packages/real-bodies/src/github-bridge.ts",
    "packages/real-bodies/test/structure.test.ts",
    "tests/real-github/package.json",
    "tests/real-github/tsconfig.json",
    "tests/real-github/tsconfig.build.json",
    "tests/real-github/vitest.config.ts",
    "tests/real-github/vitest.real.config.ts",
    "tests/real-github/scripts/run-tests.mjs",
    "tests/real-github/test/world.ts",
    "tests/real-github/test/github-port-contract.test.ts",
    "tests/real-github/test/real/real-github-journey.test.ts",
    "tests/real-bodies/package.json",
    "tests/real-bodies/tsconfig.json",
    "tests/real-bodies/tsconfig.build.json",
    "tests/real-bodies/vitest.config.ts",
    "tests/real-bodies/vitest.real.config.ts",
    "tests/real-bodies/scripts/run-tests.mjs",
    "tests/real-bodies/test/world.ts",
    "tests/real-bodies/test/github-bridge-world.ts",
    "tests/real-bodies/test/hosted-body-contract.test.ts",
    "tests/real-bodies/test/body-replaceability.test.ts",
    "tests/real-bodies/test/real/real-body-journey.test.ts",
    "docs/evidence/production-connectivity/github-execution/github-integration.json",
    "docs/evidence/production-connectivity/github-execution/real-body-execution.json",
    "docs/evidence/production-connectivity/github-execution/provider-states.json",
    "docs/evidence/production-connectivity/github-execution/ARCHITECTURE-DELTA.json"
  ],
  "removed": [],
  "modified": [
    "pnpm-lock.yaml (new workspace importers only: packages/real-github, packages/real-bodies, tests/real-github, tests/real-bodies — zero external registry dependencies added; pnpm-workspace.yaml untouched)"
  ],
  "preserved_invariants": [
    "the frozen W0-W18 core and every merged product package (P0-P16) are consumed read-only through their public exports only — no internal package mutation; pnpm-workspace.yaml is byte-identical (the packages/* and tests/* globs already covered the new importers)",
    "the P4 GitHubPort contract stays authoritative: @sos-2/real-github is a GitHubPort realization over the injectable GitHubRequestPort HTTP seam (the exact P4 attachment design); its github-vocabulary.ts is a STRUCTURAL mirror (the frozen P8 body-runtimes precedent — the P4 package is zero-dependency with no module entry point) whose field-for-field alignment with the real P4 sources is pinned by test via non-literal dynamic imports",
    "no vendor becomes part of SOS semantics: GitHub and OpenRouter are adapters behind frozen provider-neutral contracts; provider identity is provenance metadata only; the model is a replaceable mechanism whose output is parsed by a bounded protocol and never authoritative",
    "the §9 HarnessContract is consumed UNCHANGED: the hosted coding-harness body is a plain HarnessContract implementation; the async model API is driven through the documented provider-side engine with every result flowing back through the synchronous §9 surface (the frozen P8 sync-seam composition discipline — github-operations.ts: 'the async -> sync bridge therefore lives at the COMPOSITION boundary')",
    "honest provider states: CONNECTED only after a real authenticated probe (verifyToken probes GET /user); the OAuth app authorization surface is implemented while live operation is PAT-backed (recorded honestly); GitHub rate limits surface as DEGRADED with REAL reset epochs; provider failures answer typed UNSUPPORTED outcomes carrying the truthful status — never a fabricated success; the P17-B provider-state vocabulary is adapter control-plane data (P4/W12 precedent), never a redefinition of the frozen connection statuses",
    "a body cannot mint or widen authority or self-certify completion (§10): the body completion report is a non-authoritative observation (the task stays RUNNING — pinned by test); the INDEPENDENT evaluator gates completion (including the EVALUATION_INDEPENDENCE_VIOLATION denial for body-bound probes); the real journey's evaluator EXECUTED the generated test under node before the Spirit side completed the task",
    "bodies remain REPLACEABLE: the same dispatch script serves the reference CloudCodingShellBody and the real HostedCodingBody with identical contract behavior (pinned by test); the P5 broker replaces the body underneath an active lease while the durable task identity, checkpoints, artifacts and observations survive (pinned by test, including the bit-exact content-addressed artifact read-back after replacement)",
    "cloud execution never requires the user's computer (§7): placement cloud, the egress allowlist carries only the model provider, zero device probes — pinned by test and asserted in the real-run evidence",
    "the lease is fail-closed and checkpoints are durable: an expired lease authorizes nothing (pinned by test); the real journey recorded the lease id, checkpoints and artifacts in its evidence transcript",
    "deterministic reference-mode discipline: the offline suites (scripted request ports + scripted model ports, fixed vitest seed 424242) run run-to-run identical with zero network; the real-provider suites are env-gated (RUN_REAL=1, default OFF) and STRICTLY SEPARATED (separate vitest configs; the default test script never loads the real files)",
    "secret discipline per the @sos-2/security contracts: credentials are env-only, injected at the composition boundary, never in source, never echoed; evidence carries env NAMES only (pinned by redaction scans over every outcome, note, provider-state report, telemetry record and the evidence files themselves)",
    "zero external dependencies added: the new packages declare workspace:* + the existing toolchain only (typescript ^5.5.0, vitest ^3.0.0, @types/node ^22.10.0); the lockfile change is importer addition only; pnpm install --frozen-lockfile passes on the branch"
  ],
  "boundary_changes": [],
  "rationale_ref": "spec/productization-work-orders/P17B-real-github-execution.md",
  "work_order": "P17-B"
}
