{
  "affected_artifacts": [
    "apps/web/app/mission",
    "apps/web/app/live-mission",
    "apps/web/app/api/live-mission",
    "apps/web/live-mission",
    "tests/live-ux/actions",
    "docs/evidence/production-connectivity/live-ux/actions-mission",
    "pnpm-workspace.yaml",
    "pnpm-lock.yaml"
  ],
  "added": [
    "apps/web/app/live-mission/data-seam.ts",
    "apps/web/app/live-mission/page.tsx",
    "apps/web/app/api/live-mission/actions/route.ts",
    "apps/web/app/mission/live-actions/host.ts",
    "apps/web/app/mission/live-actions/console-authority.ts",
    "apps/web/app/mission/live-actions/console-ask-queue.ts",
    "apps/web/app/mission/live-actions/submission.ts",
    "apps/web/app/mission/live-actions/live-executors.ts",
    "apps/web/app/mission/live-actions/receipt-view.ts",
    "apps/web/app/mission/live-actions/adapters/openrouter-probe.ts",
    "apps/web/app/mission/live-actions/adapters/vercel-records.ts",
    "apps/web/app/mission/live-actions/receipts/receipt-html.ts",
    "apps/web/app/mission/package.json",
    "tests/live-ux/actions/package.json",
    "tests/live-ux/actions/tsconfig.json",
    "tests/live-ux/actions/vitest.config.ts",
    "tests/live-ux/actions/vitest.real.config.ts",
    "tests/live-ux/actions/scripts/run-real-if-env.mjs",
    "tests/live-ux/actions/scripts/deploy-p18b.mjs",
    "tests/live-ux/actions/scripts/set-project-env.mjs",
    "tests/live-ux/actions/scripts/secret-scan-live-ux-actions.mjs",
    "tests/live-ux/actions/test/endpoint-contract.test.ts",
    "tests/live-ux/actions/test/authority-gates.test.ts",
    "tests/live-ux/actions/test/idempotency.test.ts",
    "tests/live-ux/actions/test/ask-resolution.test.ts",
    "tests/live-ux/actions/test/receipt-rendering.test.ts",
    "tests/live-ux/actions/test/mount-seams.test.tsx",
    "tests/live-ux/actions/test/provider-adapters.test.ts",
    "tests/live-ux/actions/test/redaction.test.ts",
    "tests/live-ux/actions/test/helpers/scripted-vercel.ts",
    "tests/live-ux/actions/test/real/real-actions.real.test.ts",
    "docs/evidence/production-connectivity/live-ux/actions-mission/README.md",
    "docs/evidence/production-connectivity/live-ux/actions-mission/ARCHITECTURE-DELTA.json",
    "docs/evidence/production-connectivity/live-ux/actions-mission/secrets-audit.json",
    "docs/evidence/production-connectivity/live-ux/actions-mission/deployment-record.json",
    "docs/evidence/production-connectivity/live-ux/actions-mission/action-receipts.json",
    "docs/evidence/production-connectivity/live-ux/actions-mission/http-transcripts.json",
    "docs/evidence/production-connectivity/live-ux/actions-mission/provider-states.json"
  ],
  "removed": [],
  "modified": [
    "apps/web/app/mission/page.tsx (REPLACED — the read-only mission view is now the P17-C live Mission experience mounted through the architect-defined data seam; the frozen shell navigation contract stays satisfied — the wrapper is thin and references the replaced shell mission page)",
    "pnpm-workspace.yaml (mechanical importer additions only: apps/web/app/mission + tests/live-ux/actions — the P18-A apps/web/live-data precedent; zero dependency-graph changes beyond workspace:* importer entries)",
    "pnpm-lock.yaml (new workspace importers only — zero external registry dependencies added)"
  ],
  "preserved_invariants": [
    "the P17-C UI module (apps/web/live-mission) stays BYTE-IDENTICAL to its base: the frozen components/view-state/envelope sources are consumed read-only through their public exports; the merged P17-C structure suite (ambient-free UI module, restricted imports, the pnpm-workspace live-mission-entry prohibition) stays green exactly as at base — the lane's integration seams therefore live in the colocated non-route module apps/web/app/mission/live-actions (the lane's OTHER owned path; the P18-C start-surface colocation precedent)",
    "the merged @sos-2/action-gateway is consumed read-only through its public exports: every consequential action flows through ActionGateway.execute (validate -> idempotency claim -> CURRENT authority re-evaluation at action time, fail-closed -> executor seam -> evidence + event emission); the envelope builders' outputs are byte-frozen inputs; a smuggled authority field stays the typed AUTHORITY_FIELD_SMUGGLED rejection",
    "authority is re-evaluated AT ACTION TIME and fails closed: the operator's env-declared grant set (LIVE_MISSION_GRANTS) is re-read per action; unset/empty denies everything (GRANT_NEVER_HELD); a provider credential is never authority by itself; the executor is NEVER invoked on denial (pinned by test with a counting model port)",
    "idempotency: the same envelope replays the recorded original receipt (never a second execution — pinned per consequential family and for the frozen forms' identity-incomplete envelopes, whose identity is derived DETERMINISTICALLY from the envelope content); the ASK resolution is terminal (an entry resolves at most once; a second resolution is the typed already-RESOLVED failure)",
    "the merged @sos-2/ask AskQueue.resolve() is the ONLY ask path (human resolution authority; the queue mints the Decision record through @sos-2/decision bound to the ask's exact input digest); the console seeds ONE deterministic reference ask through the REAL machinery (evaluate -> ASK -> createAskRequest -> enqueue) with fixed literals — honestly labelled process-local",
    "honest provider states (the P17-C four-state machine): CONNECTED only after a real probe answers (the OpenRouter model completion; the Vercel records read), UNAVAILABLE with the exact error, UNKNOWN when unconfigured — never fabricated; the promotion/rollback executors bind to REAL deployment records (exact source_revision_sha; fail-closed NO_REAL_DEPLOYMENT_FOR_SHA for never-deployed revisions) and the console does NOT mutate the provider's physical alias (the receipt says so)",
    "no durable confirmation is fabricated: the canonical durable stores are DNS-unreachable (the P18-A recorded facts), so the idempotency store, event log, evidence sink and ask queue are process-local and every receipt carries the honest scope note",
    "server-rendering discipline is preserved: no client components, no client fetches — the mission routes render server-side from the seam's props; the endpoint answers browser form POSTs with a self-contained server-rendered receipt document (Next 16 forbids react-dom/server in route handlers, so the document is a carefully escaped HTML string carrying the same design tokens, a11y standards and the machine-checkable JSON data island)",
    "secrets are env-only and never committed, logged or echoed: credentials arrive through the composition boundary (the P3 typed-registry NAMES: VERCEL_TOKEN, VERCEL_PROJECT_ID, VERCEL_ORG_ID, BODY_PROVIDER_API_KEY, BODY_PROVIDER_MODEL, GITHUB_ACCESS_TOKEN for the GitHub runtime adapter, LIVE_MISSION_GRANTS as the operator's non-credential authority declaration); evidence carries env NAMES only; the lane secrets audit (the merged lane corpora) scans every owned path with 0 findings",
    "deterministic reference-mode discipline: the offline suite (fixed vitest seed 424242) runs run-to-run identical with zero network (scripted model ports + scripted Vercel FetchPorts + injected clocks/env); the real-provider suite is env-gated (RUN_REAL=1, default OFF) and STRICTLY SEPARATED (its own vitest config; the default test script never loads the real files)",
    "the full repo suite stays green exactly as at base (including the P17-C structure suite and the frozen shell navigation contract's thin-wrapper pin on the mission route)",
    "zero external registry dependencies added: the new importers declare workspace:* only; the lockfile change is importer addition only; pnpm install --frozen-lockfile passes on the branch"
  ],
  "boundary_changes": [
    "NEW workspace importers: apps/web/app/mission (@sos-2/web-live-actions — the colocated source-only action-composition module) and tests/live-ux/actions (@sos-2/tests-live-ux-actions — the lane's two strictly separated suites); both follow the P18-A apps/web/live-data importer precedent (the mechanical pnpm-workspace.yaml addition sanctioned by the task packet)",
    "PER-DEPLOYMENT build-command override on this lane's Vercel deployment (the PROJECT setting is NOT modified — verified post-run): the frozen closure command is extended with 'pnpm --filter @sos-2/web-live-actions^... run build' so the endpoint's dependencies build before next build; PROPOSED ACR: either scope the P17-C structure suite's ambient/import scan to the frozen P17-C files so integration seams can join apps/web/live-mission per the task packet, or bless the colocated live-actions module as the standing pattern; and fold @sos-2/action-gateway/@sos-2/deployment-providers/@sos-2/real-bodies into apps/web/package.json (the architect's one-line integration) so the per-deployment override can retire"
  ],
  "rationale_ref": "spec/productization-work-orders/P18-live-ux-action-wiring.md",
  "work_order": "P18-B"
}
